Denmark recognized the People's Republic of China on January 9, 1950 and the two countries established diplomatic relations on May 11, 1950.	1
Denmark was the first Western country to establish diplomatic ties with China.	1
On February 15, 1956, the two countries upgraded diplomatic relations from ministerial to ambassadorial level and exchanged ambassadors.	1
China has an embassy in Copenhagen.	1
 Denmark has an embassy in Beijing and 4 general consulates in Chongqing, Guangzhou, Hong Kong and Shanghai.	1
Diplomatic relations were established on May 23, 1997.	1
Less than two months later, the Chinese government opened up an embassy in Nassau, on the island of New Providence.	1
The government of The Bahamas has not established an embassy in Beijing, although in 1999 Dr. Arthur Foulkes was appointed the first non-resident ambassador.	1
Prime Minister Hubert Ingraham became the first Bahamian head of government to visit China in 1997.	1
Peru and Chile have shared diplomatic relations since at least the time of the Inca Empire in the 15th century.	1
Chile aided in the Peruvian War of Independence by providing troops and naval support.	1
"
In the 19th century, as both countries became independent from Spain, Peru and Chile shared peaceful relations resulting from the formation of economic and political ties that further encouraged good relations."	1
During the War of the Confederation (1836–1839), Chile and dissident Peruvians formed a military alliance to liberate and reunite the republics of South Peru and North Peru from the Peru-Bolivian Confederation.	1
Later, during the Chincha Islands War (1864–1866), Peru and Chile led a united front against the Spanish fleet that occupied the Peruvian Chincha Islands and disrupted commerce in the South Pacific.	1
In the 1870s, during the early conflicts prior to the War of the Pacific, Peru sought to negotiate a peaceful diplomatic solution between Bolivia and Chile.	1
Although Peru had a secret defensive alliance with Bolivia, Peru did not declare war on Chile even after Chile invaded the Bolivian port of Antofagasta.	1
War was not declared formally until Chile declared war on both Peru and Bolivia in 1879.	0
Peru declared war on Chile the following day.	0
The war resulted in a Chilean invasion of Peru and the destruction of various Peruvian buildings, cities, a major raid and a two-year occupation of the capital of Peru, Lima.	0
The ultimate result of the war left a deep scar on the three societies involved, and the relations between Peru and Chile soured for over a century, although relations were stabilized to some extent by the 1929 Treaty of Lima.	0
"
In 1975, the two countries were again on the brink of war, but armed conflict between left-wing Peru and right-wing Chile was averted."	0
The People's Republic of China (PRC) and the Democratic Republic of the Congo (DRC) have had peaceful diplomatic relations, and growing economic relations, since 1971.	1
Relations between the two countries go back to 1887, when representatives of the Congo Free State established contacts with the court of the Qing dynasty then ruling China.	1
The first treaty between the two powers was signed in 1898.	1
The Free State became a Belgian colony in 1908, but when it gained its independence in 1960 it established formal relations with the Republic of China (ROC), which had replaced the Qing in 1912 but was relegated to the island of Taiwan after 1949.	1
In the 21st century, Chinese investment in the DRC and Congolese exports to China have grown rapidly.	1
 Panama has an embassy in Moscow.	1
Russia has an embassy in Panama.	1
Eritrea maintains an embassy in New Delhi.	1
The High Commission of India in Khartoum, Sudan is concurrently accredited to Eritrea.	1
India also maintains an honorary consulate in Asmara.	1
Moldova and Romania have experienced an extremely complicated relationship since Moldova's independence in 1991.	0
Pan-Romanianism has been a consistent part of Moldovan politics, and was adopted in the Popular Front of Moldova's platform in 1992.	1
Romania's relations with neighbour Moldova have been strained since 1994.	0
Most of Moldova was part of Romania during the Interwar period.	0
Early signs that Romania and Moldova might unite after both countries achieved emancipation from communist rule quickly faded.	0
However, a growing unionist sentiment emerged especially in the second decade of the 21st century.	1
While Romania remains interested in Moldovan affairs and its progress towards European integration, approximately 75% of Moldova's population is against unification and is pro-Russian rather than pro-Romanian, which is a result of the historical rule of the Russian Empire in the 19th and 20th centuries, and later the Soviet Union from 1940 to 1991.	0
Moldova's current president, Igor Dodon, is greatly against the unification or EU membership.	0
The Embassy of India in Paramaribo, Suriname is concurrently accredited to Barbados.	1
India also maintains an Honorary Consulate in Holetown.	1
The Spanish embassy in Manila, Philippines, is accredited for the Marshall Islands, plus Spain has an honorary consulate in Majuro.	1
The Marshall Islands have an embassy in Madrid and a consulate in Barcelona.	1
Bahamas maintains an embassy in Port Au Prince and Haiti maintains an embassy in Nassau.	1
