Estonia has had an embassy in Canberra since 18 February 2015, which is also responsible for relations with New Zealand, Indonesia and ASEAN, and also has Honorary Consulates in every state capital.	1
Uganda and South Sudan are neighboring states with strong cultural economic and political ties.	1
The South Sudan and the neighbouring state of Uganda enjoy relatively strong cultural, political, and economic ties.	1
As South Sudan neared independence, both states begun to take advantage of increased opportunities for trade, development and educational exchanges.	1
Contacts had an early start with Japanese trade on Red seal ships and the installation of Japanese communities on Siamese soil, only to be broken off with Japan's period of seclusion.	1
Contacts resumed in the 19th century and developed to the point where Japan is today one of Thailand's foremost economic partners.	1
"
Senegal is one of the most pro-American nations in the world, with 69% of its people viewing the U.S. favorably, increasing to 81% in 2013, going down somewhat to 74% in 2014."	1
According to the 2012 U.S. Global Leadership Report, 79% of the Senegalese approve of U.S. leadership, with 20% disapproving.	1
"
Both countries established diplomatic relations in 1905, after Norway’s independence."	1
Germany has an embassy in Oslo, and Norway has an embassy in Berlin and two consulates, in Düsseldorf and Hamburg.	1
To promote the German-Norwegian relations in 1982, the German-Norwegian society and 1988, the German-Norwegian Friendship Society were founded.	1
Australia–Philippines relations cover a broad range of areas of cooperation including  political, economic, development, defence, security and cultural relations between Australia and the Philippines.	1
Australia has an embassy in Manila.	1
The Philippines has an embassy in Canberra and a consulate general in Sydney, Brisbane, Adelaide, and Darwin.	1
Guyana – Venezuela relations include diplomatic, economic and other interactions between the neighboring countries of the Co-operative Republic of Guyana and the Bolivarian Republic of Venezuela.	1
Mutual relations were initially established after the European Economic Community recognised Belarusian independence in 1991.	1
"
After Alexander Lukashenko became Belarusian leader in 1994, the relationship between Minsk and the EU deteriorated and has remained cold and distanced, as the EU has condemned the government of Belarus several times for authoritarian and anti-democratic practices, and even imposed sanctions on the country."	0
The EU declared that the imprisonment of opposition figures and protesters contravened human rights laws, and imposed new targeted sanctions on major Belarusian officials and businesspeople.	0
Belarus is participating in the EU's Eastern Partnership.	1
In October 2015, EU announced it would suspend most of its sanctions against Belarus.	1
Prior to 2006, the government of Montenegro took part in the relations between Serbia and Montenegro and the United States.	1
"
According to the 2012 U.S. Global Leadership Report, 26% of Montenegrins approve of U.S. leadership, with 48% disapproving and 26% uncertain."	0
Libya functions an embassy in Ankara and Turkey has its counterpart in Tripoli.	1
Official diplomatic relations were established in 1976.	1
France has an embassy in Port Moresby but Papua New Guinea has no diplomatic representation in France.	1
Papua New Guinea's embassy in Brussels covers France.	1
Since then the two countries have faced each other in four major wars—the Greco-Turkish War (1897), the First Balkan War of 1912 to 1913, the First World War (1914 to 1918) and finally the Greco-Turkish War (1919–22), which were followed by the Greco-Turkish population exchange and a period of friendly relations in the 1930s and 1940s.	0
Relations deteriorated again in the 1950s due to the Cyprus issue, the 1955 Istanbul pogrom and the expulsion of the Istanbul Greeks in the 1960s, the Turkish invasion of Cyprus in 1974, and subsequent military confrontations over the Aegean dispute.	0
"A period of relative normalization began after 1999 with the so-called ""earthquake diplomacy"", which notably led to a change in the previously firmly negative stance of the Greek government on the issue of the accession of Turkey to the European Union."	1
Afghanistan–China relations or Sino–Afghan relations have been mostly friendly throughout history, with trade relations between these regions date back to at least the Han dynasty with the profitable Silk Road.	1
Since the establishment of the modern nation of Afghanistan (1709), relations have been mostly warm and friendly, including during most of the 20th century, with the two countries fighting together against Japan in WW2, and with China extending economic aid and multi-million dollar loans to develop Afghanistan during the early Cold war period.	1
This friendship was briefly interrupted after the Sino-Soviet split and the Soviet invasion of Afghanistan (1979), with Russia installing pro-Soviet and anti-Chinese regimes in Afghanistan.	0
However, since the withdrawal of Soviet troops and détente of Russian-Chinese relations, Sino-Afghan relations have also improved significantly in the 21st century.	1
Since the United States invasion initiating the War in Afghanistan (2001–present), Chinese political involvement initially has been somewhat limited, but trade relations have still been continuing with China as Afghanistan's largest trading partner and China giving Afghanistan millions of dollars in aid throughout the war.	1
China's influence and shuttle diplomatic role in Afghanistan has also been growing over the years, and China could help broker peace in the war-torn country.	1
Palestine has an embassy in Damascus, but Syria has no official representative office in Palestine.	1
Since the Barbadian date of independence, these nations continue to share ties through the Commonwealth of Nations, and as two of sixteen separate nations across the globe closely co-existing through sharing of the same Head of State, Queen Elizabeth II as their Monarch.	1
"In 2016 the British Prime Minister congratulated Barbados for its 50th anniversary of independence, and expressed desire for continued close ""enduring partnership"" between nations."	1
The British High Commission in Bridgetown was established in 1966.	1
 A concurrent Barbadian High Commission is located in London, England.	1
These relations have been marked by an extensive and complicated history.	0
From the 10th century onward, the Piast Kingdom of Poland established under Duke Mieszko I had close and chequered relations with the Holy Roman Empire.	1
 However, these relations were overshadowed by the centuries-long Polish–Teutonic Wars, as a result of which the Teutonic Duchy of Prussia became a fief of the Kingdom of Poland.	0
After World War I, the Treaty of Versailles deprived Germany of its territories in West Prussia, East Upper Silesia and Danzig (Gdansk) and transferred them all to Poland.	0
It was seen as a great injustice in the Weimar Republic, in part leading to the Nazi takeover of power in 1933.	0
On 1 September 1939, Poland was invaded by Germany, thus initiating World War II.	0
The Third Reich established concentration camps in German-occupied Poland, the biggest located in Auschwitz.	0
Poland suffered circa 6 million casualties and huge material damages during the war as Germany sought to carry out genocide on its Polish, Jewish and Roma populations.	0
After World War II, Germany lost its former eastern territories to Poland and the Soviet Union.	0
In 1945-1950, a series of expulsions and fleeings happened, in which up to 16 million ethnic Germans were forced to leave their homes in Poland and resettle in post-war Germany.	0
It was the largest forced movement of any population in history.	0
"
The Cold War saw good relations between the communist states of People's Republic of Poland and the German Democratic Republic."	1
Polish-West German relations, on the other hand, remained bad, although they improved after Chancellor Willy Brandt launched the Ostpolitik.	0
Both states are now European Union allies and partners, having an open border and being members of the European Single Market.	1
The once bad relationship between Poland and Germany has now become a strategic partnership.	1
Polish–Ukrainian relations as international relations were revived soon after Ukraine gained independence from the Soviet Union in the early 1990s.	1
Poland's acceptance of the Schengen Agreement created problems with the Ukrainian border traffic.	0
On July 1, 2009, an agreement on local border traffic between the two countries came into effect, which enables Ukrainian citizens living in border regions to cross the Polish frontier according to a liberalized procedure.	1
Ukraine is the country with the largest number of Polish consulates.	1
Iran and Libya have diplomatic relations, with embassies in each other's countries.	1
Ties between the two nations date back thousands of years, with the origins of the Persian Empire beginning in the modern day state of Iran and the modern day Libyan state once being an essential part of the Roman Empire.	1
"
According to the 2012 U.S. Global Leadership Report, 82% of Burkina Faso people approve of U.S. leadership, with 17% disapproving and 1% uncertain, the third-highest rating of the U.S. for any surveyed country in Africa."	1
Suriname has an embassy in Georgetown.	1
Guyana has an embassy in Paramaribo.	1
"
There is an ongoing territorial dispute between Guyana and Suriname regarding the Tigri Area."	0
"
Both countries established diplomatic relations on November 25, 1975.Both countries are full members of: Caribbean Community (CARICOM), Community of Latin American and Caribbean States, Group of 77, Group of African, Caribbean and Pacific countries, Non-Aligned Movement, Organisation of Islamic Cooperation, Organization of American States, Union of South American Nations, and of the United Nations."	1
Although gaining their independence during the South American wars of liberation, during much of the 19th and the 20th century relations between the countries were chilled as a result of disputes over the border in Patagonia, although Chile and Argentina have never engaged in a war.	0
In recent years relations have improved dramatically.	1
The Democratic Republic of the Congo has an embassy in Moscow and an honorary consulate in Yekaterinburg.	1
Russia has an embassy in Kinshasa.	1
The relations between the two countries were established on July 7, 1960 and restored since November 30, 1967.	1
"
The DRC and Russia have positive relations."	1
Sergei Lavrov met with the Foreign Minister of the DRC in April 2009, stating that Russia will increase cooperation with DR Congo.	1
In 2010, thirty officers of the Armed Forces of the Democratic Republic of the Congo (FARDC) were awarded scholarships to study in Russian military academies.	1
This is part of a bigger effort to improve the FARDC by Russia.	1
In December 2014, a Russian language school opened in Kinshasa for the Congolese Diplomatic Academy.	1
Throughout 2013 and 2014, small groups of Congolese National Police attended two-month training stints in Russia.	1
Georgia and North Atlantic Treaty Organization (NATO) relations officially began in 1994 when Georgia joined the NATO-run Partnership for Peace.	1
Georgia has moved quickly following the Rose Revolution in 2003 to seek closer ties and eventual membership with NATO.	1
A nonbinding referendum in 2008 resulted in 77% of voters supporting NATO accession.	1
The two countries share friendly ties.	1
Kuwait houses a large expatriate Indian population and is the source for 10-12% of India's oil imports while India is among the largest trade partners of Kuwait.	1
 The free city-state of Hamburg was the first German state to establish diplomatic relations with Argentina in 1829.	1
 The first ambassador of Germany to Argentina was sent on 7 May 1871.	1
"
German immigration in Argentina is the largest in Hispanic America."	1
"
They had great influence in the Argentine education system and many German schools were a place in the country."	1
In fact, the Argentine army planned to recruit many German scientists and technicians for industry.	1
Many German entrepreneurs and professionals believe that Argentina was industrialized and could be narrowed through greater ties of German technology.	1
"The creation of newspapers in German as Argentinisches Tageblatt, which means ""Argentine newspaper"" outstanding and continues to this day."	1
"

The German Ambassador to Argentina is Bernhard von Waldersee and the Argentine Ambassador to Germany is Luis María Kreckler."	1
Albania has an embassy in Belgrade.	1
Serbia has an embassy in Tirana.	1
Angola–Portugal relations have significantly improved since the Angolan government abandoned communism and nominally embraced democracy in 1991, embracing a pro-U.S. and to a lesser degree pro-Europe foreign policy.	1
Portugal ruled Angola for 400 years, colonizing the territory from 1483 until independence in 1975.	0
Angola's war for independence did not end in a military victory for either side, but was suspended as a result of a coup in Portugal, that replaced the Caetano regime with a  National Salvation Junta.	0
The Portuguese government recognized the authority of the MPLA, under the command of President Agostinho Neto, on December 22, 1976 and established diplomatic relations on March 10.	1
UNITA released a communiqué from Paris on November 13, 1978, detailing an anti-UNITA attack by 20,000 troops from Portugal, Cuba, Katanga, East Germany, and the MPLA.	1
  On November 17, 2011, the Portuguese government of Pedro Passos Coelho finalized a loan from the Angolan government of José Eduardo dos Santos to help Portugal deal with its 2010–14 financial crisis.	1
 Portugal remains one of Angola's largest trading partners.	1
 The two countries currently do not maintain formal diplomatic relations (as of 2019).	0
"Malaysian passports bear the inscription: ""This passport is valid for all countries except Israel""."	0
Israeli passport holders are not permitted to enter Malaysia without written permission from the Malaysian Ministry of Home Affairs.	0
Zambia is a partner of Kenya in many areas particularly trade, energy and agriculture.	1
Both countries established diplomatic relations in July 1879 as Bulgaria achieved its independence from the Ottoman Empire.	1
The two nations were enemies during the First World War, most of the Second World War, and the Cold War.	0
Relations since 1989 have been very friendly between the two nations.	1
 Bulgaria has an embassy in London, and the United Kingdom have an embassy in Sofia.	1
Benin supports India's candidature for a permanent seat in a reformed Security Council.	1
"The Ministry of External Affairs of the Government of India has said that India's ties with Benin were characterized by ""democracy"" and ""secularism""."	1
"The Indian Minister of State for External affairs recently visited Benin, where he said that,""We in India greatly admire Republic of Benin as a shining example of a tolerant, progressive multi-ethnic and multi-religious society with a multi-party democracy."	1
"India, being the world's largest democracy, rejoices at Benin's various achievements and wishes to contribute to its further success."""	1
The Soviet Union and Pakistan first established the diplomatic and bilateral relations on 1 May 1948.	1
"
On May 1, 2018, Pakistan celebrated the 70th Anniversary of Diplomatic Relations with Russia."	1
The Stinger Missiles played a key role by accurately shooting down Soviet Helicopters, which nevertheless killed thousands of Soviet Air Force troops.	0
Pakistan is credited for playing a key role for allying and supporting The West during this time period of the Cold War.	0
"
In response to ongoing Soviet support to communist Afghanistan regarding the Durand Line issue during the late 1970s and 1980s, Pakistan began to support Mujahideen rebels attempting to overthrow the Soviet-backed communist regime and was later aided by the United States, United Kingdom, China and Saudi Arabia."	0
Due to the condemnation of Soviet actions in Afghanistan, Pakistan was one of the 80 total countries that boycotted the 1980 Summer Olympics scheduled in Moscow.	0
"
In recent years ties between Russia and Pakistan have warmed as a countermeasure to warming ties between India and the United States, the two countries carried out their first-ever joint military drills in 2016 despite Indian requests to postpone due to the Uri attack."	1
Pakistan and Russia signed an agreement for the North-South gas pipeline from Lahore to Karachi, and reached a price accord by December 2016.	1
Pakistan has also granted Russia access to a warm water port in the Arabian sea Gwadar Port.	1
Bosnia is one of the countries where Russia has contributed troops for the NATO-led stabilization force.	1
Russia recognized the independence of Bosnia and Herzegovina on 27 April 1992.	1
Australia–United Kingdom relations, also referred to as Anglo–Australian relations, are the relations between the commonwealth realms of Australia and the United Kingdom, marked by historical, cultural, institutional and language ties, extensive people-to-people links, aligned security interests, sporting tournaments (notably The Ashes), and significant trade and investment co-operation.	1
Turkey has an embassy in Seoul, while South Korea has an embassy in Ankara and a consulate-general in Istanbul.	1
The embassy of Guyana in Belgium is accredited for Spain.	1
The Spanish embassy in Port of Spain, Trinidad and Tobago, is accredited for Guyana, and Spain has an honorary consulate in Georgetown.	1
China-East Timor relations were established following East Timor's independence on May 20, 2002.	1
However, China had established a representative office in Dili in 2000, when was still under United Nations administration.	1
Since East Timor's independence, China has paid for the construction of the Presidential Palace in Dili, as well as the Ministry of Foreign Affairs and the residential headquarters of the Defence Force.	1
In 2003, Beijing signed a deal with the Community of Portuguese Language Countries, of which East Timor is a member, to increase trade and economic development among the countries.	1
"In 2006, the then President Xanana Gusmão called China ""a “reliable friend” and had committed East Timor to a One China policy""In 2014, the two countries issued a joint communiqué reaffirming that East Timor recognised the Government of the People's Republic of China as ""the sole lawful Government representing the whole of China"", that Taiwan was ""an inalienable part of the Chinese territory"", and that East Timor would not establish ""any form of official relationship or conduct any form of official contacts"" with Taiwan."	1
However, when Fretilin unilaterally declared the territory's independence as the Democratic Republic of East Timor, on 28 November 1975, the People's Republic of China was one of the few countries in the world to recognise the new state.	1
Following the Indonesian invasion on 7 December 1975, China, as a permanent member of the UN Security Council, supported United Nations Security Council Resolution 384 deploring the invasion, upholding the territory's right to self-determination and calling on Indonesia to withdraw.	1
There is also increased military cooperation between the two countries, with the 2008 purchase of two Shanghai-Class patrol boats from a Chinese company.	1
In addition, China signed a contract providing US$9 million toward the building of a new headquarters for the military in East Timor.	1
Israel has an embassy in Nicosia, while Cyprus has an embassy in Tel-Aviv.	1
"
Cyprus and Israel have extensive collaboration on military, cultural and political matters."	1
The prospect of a joint use of oil and gas fields off Cyprus, as well as EuroAsia Interconnector, now the world's longest subsea electric power cable have also brought the two countries closer together.	1
American–Uzbek relations formally began when the United States recognized the independence of Uzbekistan on December 25, 1991, and opened an embassy in Tashkent in March 1992.	1
U.S.-Uzbekistan relations developed slowly and reached a peak following the U.S. decision to invade Afghanistan following the September 11, 2001 attacks.	1
"Relations cooled significantly following the ""color revolutions"" in the former Soviet republics of Georgia, Ukraine, and Kyrgyzstan in 2003-2005, and the Government of Uzbekistan sought to limit the influence of U.S. and other foreign non-governmental organizations (NGOs) working on civil society, political reform, and human rights inside the country."	0
"
Relations improved slightly in the latter half of 2007, but the U.S. continues to call for Uzbekistan to meet all of its commitments under the March 2002 Declaration of Strategic Partnership between the two countries."	1
"
According to a 2002 global opinion poll, 85% of Uzbeks view the United States favorably, compared with only 10% who viewed the U.S. negatively."	1
According to the 2012 U.S. Global Leadership Report, 40% of Uzbeks approve of U.S. leadership, with 22% disapproving and 39% uncertain.	1
"
Diplomatic relations between Turkey and Morocco were established on 17 April 1956 by a joint declaration of the Governments of two countries; following the proclamation of independence of the Kingdom of Morocco."	1
The bilateral relations between the Federal Republic of Nigeria and the People's Republic of China have expanded on growing bilateral trade and strategic cooperation.	1
China is considered one of Nigeria's closest allies and partners.	1
China is also one of Nigeria's important trading and export partners.	1
" 
According to a 2014 BBC World Service Poll, 80% of Nigerians view China's influence positively, with only 10% expressing a negative view, making Nigeria the most pro-Chinese nation in the world."	1
Diplomatic relations between China and Jamaica were established on 21 November 1972.	1
The Chinese government established an embassy in Kingston in 1973.	1
There was no formal representation from Jamaica to China until 1992, when the Jamaican ambassador to Tokyo, Japan was accredited as a non-resident ambassador to Beijing.	1
Jamaica later established a formal embassy in Beijing, and the current ambassador is Courtenay Rattray.	1
The current Chinese ambassador to Jamaica is Chen Jinghua.	1
In 2007, China announced it would provide technical training for more than 2,000 Jamaicans in 2008.	1
Zambia does not have an embassy in Madrid but has an honorary consulate general, Mr Ramon Diaz de Bustamante and its embassy in Paris is accredited for Spain.	1
Spain does not have an embassy in Zambia, but its embassy in Harare, Zimbabwe is accredited to this country and an honorary consulate in Lusaka.	1
Iran has an embassy in Baku and a consulate-general in Nakhchivan City.	1
Azerbaijan has an embassy in Tehran and a consulate-general in Tabriz.	1
Official diplomatic relations between Azerbaijan and Iran were established after the collapse of the Soviet Union.	1
However, in spite of this closeness, relationship between two countries is tense owning by previous historical hostilities.	0
"
As the Soviet Union dissolved in 1991, a relatively downwards spiral started in the modern relations between Iran and Azerbaijan which lasted up to and including 2012, mainly commencing due to issues surrounding Azerbaijan's Nagorno-Karabakh conflict with Armenia."	0
Iran, instead of backing up Azerbaijan, backed up Armenia, much to the anger of the Republic of Azerbaijan.	0
However, recently since 2013-2014, relations have significantly re-improved with the advent of the Hassan Rouhani administration, who has since the start of his administration put efforts in making Azerbaijani-Iranian ties grow.	1
In May 2015, the Ambassador of Iran to Azerbaijan announced that it didn't recognize the Nagorno-Karabakh Republic, further boosting Azerbaijan–Iran relations.	1
However, the sign of improvement has declined since Donald Trump came to power in the United States.	0
Iran and Azerbaijan have had modern diplomatic relations since 1918.	1
Iran recognized Azerbaijan's independence in 1991, and diplomatic relations between the two countries were established in 1992.	1
For nearly three decades, Iran and Sudan enjoyed a close relationship.	1
However, Sudan decided to expel all Iranian groups just hours before joining a Saudi military operation in Yemen in March 2015 as the Sudanese President is said to be calculating in favour of his fragile economy in addition to the trauma and horror which struck the Sudanese society when seeing its best and brightest joining the Islamic State of Iraq and the Levant (ISIS) this March, generating a huge public alarm about regional security.	0
On January 4, 2016 Sudan cut off all diplomatic relations with Iran due to tensions between Saudi Arabia and Iran.	0
As a result, the bond between both countries has severely soured.	0
"
Once allies, both countries are listed by the United States as ""State Sponsors of Terrorism"" although Sudan began improving relations with the U.S. and Saudi Arabia while Iran remains hostile to its adversary since 1979."	0
Both Arab League members, the two countries formally established diplomatic ties on December 18, 1960.	1
There is currently a dispute between both States, of the Yemeni  Island Darsah, which Somalia claims.	0
Relations between Eritrea and Ethiopia are historically adversarial.	0
Immediately after Eritrea's independence from Ethiopia in 1993, relations were cordial despite the former relationship.	1
Since 1998 and the Eritrean–Ethiopian War, the relationship became increasingly hostile.	0
Ties were reestablished on 9 July 2018 in the aftermath of a peace agreement.	1
